{"id":"nyxscans","name":"Nyx Scans","version":2,"language":"en","content":["manga","manhwa","manhua"],"base":"https://api.nyxscans.com","hosts":["nyxscans.com"],"defaultCategory":"manhwa","timeoutMs":15000,"rateLimit":{"requests":3,"perSeconds":1},"headers":{"Referer":"https://nyxscans.com/","Origin":"https://nyxscans.com"},"seriesIdFromChapter":{"queryParam":"series"},"endpoints":{"popular":{"path":"/api/query","query":{"page":"{{page}}","perPage":"18","searchTerm":"","orderBy":"totalViews","orderDirection":"desc","isNovel":"false"},"cacheTtl":600,"parse":{"type":"json","list":"posts","limit":60,"fields":{"id":{"path":"slug"},"title":{"path":"postTitle"},"cover":{"path":"featuredImage"},"category":{"path":"seriesType","transform":[{"lower":true}]},"status":{"path":"seriesStatus","transform":[{"lower":true}]},"genres":{"path":"genres","transform":[{"pluck":"name"}]},"updatedAt":{"path":"lastChapterAddedAt","transform":[{"date":"iso"}]}}}},"latest":{"path":"/api/query","query":{"page":"{{page}}","perPage":"18","searchTerm":"","orderBy":"lastChapterAddedAt","orderDirection":"desc","isNovel":"false"},"cacheTtl":300,"parse":{"type":"json","list":"posts","limit":60,"fields":{"id":{"path":"slug"},"title":{"path":"postTitle"},"cover":{"path":"featuredImage"},"category":{"path":"seriesType","transform":[{"lower":true}]},"status":{"path":"seriesStatus","transform":[{"lower":true}]},"genres":{"path":"genres","transform":[{"pluck":"name"}]},"updatedAt":{"path":"lastChapterAddedAt","transform":[{"date":"iso"}]}}}},"search":{"path":"/api/query","query":{"page":"{{page}}","perPage":"18","searchTerm":"{{rawQuery}}","isNovel":"false"},"cacheTtl":300,"parse":{"type":"json","list":"posts","limit":60,"fields":{"id":{"path":"slug"},"title":{"path":"postTitle"},"cover":{"path":"featuredImage"},"category":{"path":"seriesType","transform":[{"lower":true}]},"status":{"path":"seriesStatus","transform":[{"lower":true}]},"genres":{"path":"genres","transform":[{"pluck":"name"}]},"updatedAt":{"path":"lastChapterAddedAt","transform":[{"date":"iso"}]}}}},"series":{"path":"/api/post","query":{"postSlug":"{{id}}"},"cacheTtl":600,"parse":{"type":"json","fields":{"id":{"path":"post.slug"},"title":{"path":"post.postTitle"},"author":{"path":"post.author","transform":[{"trim":true}]},"synopsis":{"path":"post.postContent","transform":[{"replace":"<[^>]+>","with":" ","flags":"g"},{"trim":true}]},"cover":{"path":"post.featuredImage"},"category":{"path":"post.seriesType","transform":[{"lower":true}]},"status":{"path":"post.seriesStatus","transform":[{"lower":true}]},"genres":{"path":"post.genres","transform":[{"pluck":"name"}]},"altTitles":{"path":"post.alternativeTitles","transform":[{"split":"\n"}]}}}},"chapters":{"path":"/api/post","query":{"postSlug":"{{id}}"},"cacheTtl":300,"parse":{"type":"json","list":"post.chapters","limit":3000,"filter":[{"field":"isLocked","equals":"true","negate":true}],"fields":{"chapterRawId":{"path":"id"},"isLocked":{"path":"isLocked"},"id":{"template":"https://api.nyxscans.com/api/chapter?chapterId={{chapterRawId}}&series={{rawId}}"},"number":{"path":"number"},"name":{"path":"title","transform":[{"trim":true}]},"publishedAt":{"path":"createdAt","transform":[{"date":"iso"}]},"scanlator":{"path":"createdBy.name"}}}},"pages":{"path":"{{chapterId}}","cacheTtl":900,"parse":{"type":"json","list":"chapter.images","limit":600,"fields":{"url":{"path":"url"}}}}}}