{"id":"tcbscans","name":"TCB Scans","version":1,"language":"en","content":["manga"],"base":"https://tcbonepiecechapters.com","hosts":["tcbonepiecechapters.com"],"defaultCategory":"manga","timeoutMs":15000,"rateLimit":{"requests":2,"perSeconds":1},"endpoints":{"popular":{"path":"/projects","cacheTtl":900,"parse":{"type":"html","list":".bg-card.border.border-border.rounded.p-3.mb-3","limit":100,"fields":{"id":{"selector":"a.mb-3.text-white.text-lg.font-bold","attr":"href","transform":[{"resolve":true}]},"title":{"selector":"a.mb-3.text-white.text-lg.font-bold","transform":[{"trim":true}]},"cover":{"selector":".w-24.h-24.object-cover.rounded-lg","attr":"src","transform":[{"resolve":true}]}}}},"latest":{"path":"/projects","cacheTtl":600,"parse":{"type":"html","list":".bg-card.border.border-border.rounded.p-3.mb-3","limit":100,"fields":{"id":{"selector":"a.mb-3.text-white.text-lg.font-bold","attr":"href","transform":[{"resolve":true}]},"title":{"selector":"a.mb-3.text-white.text-lg.font-bold","transform":[{"trim":true}]},"cover":{"selector":".w-24.h-24.object-cover.rounded-lg","attr":"src","transform":[{"resolve":true}]}}}},"search":{"path":"/projects","cacheTtl":600,"parse":{"type":"html","list":".bg-card.border.border-border.rounded.p-3.mb-3","limit":100,"filter":[{"field":"title","contains":"{{rawQuery}}","caseInsensitive":true}],"fields":{"id":{"selector":"a.mb-3.text-white.text-lg.font-bold","attr":"href","transform":[{"resolve":true}]},"title":{"selector":"a.mb-3.text-white.text-lg.font-bold","transform":[{"trim":true}]},"cover":{"selector":".w-24.h-24.object-cover.rounded-lg","attr":"src","transform":[{"resolve":true}]}}}},"series":{"path":"{{id}}","cacheTtl":900,"parse":{"type":"html","fields":{"id":{"template":"{{rawId}}"},"title":{"selector":".my-3.font-bold.text-3xl","transform":[{"trim":true}]},"cover":{"selector":".flex.items-center.justify-center img","attrs":["data-src","src"],"transform":[{"resolve":true}]},"synopsis":{"selector":".leading-6.my-3","transform":[{"trim":true}]}}}},"chapters":{"path":"{{id}}","cacheTtl":600,"parse":{"type":"html","list":"a.bg-card.border.border-border.rounded.p-3.mb-3[href]","limit":3000,"fields":{"id":{"selector":"","attr":"href","transform":[{"resolve":true}]},"number":{"selector":".text-lg.font-bold:not(.flex)","transform":[{"regex":"([0-9]+(?:\\.[0-9]+)?)","group":1},{"number":true}]},"name":{"selector":".text-gray-500","transform":[{"trim":true}]}}}},"pages":{"path":"{{chapterId}}","cacheTtl":1800,"parse":{"type":"html","list":".flex.flex-col.items-center.justify-center picture img","limit":400,"fields":{"url":{"selector":"","attrs":["data-large_image","data-full-url","data-original","data-src","data-lazy-src","src"],"transform":[{"resolve":true}]}}}}}}